Video ID,Title,Published At,Duration (Min),URL,Transcript,Summary
bcLh8jyBNKQ,BetMGM CEO Adam Greenblatt on the relationship between sports and gaming,2024-10-08 14:14:36+00:00,9,https://www.youtube.com/watch?v=bcLh8jyBNKQ,it's been an incredible year for sports betting and ey gaming so far this year the through the first seven months sports betting has grown 30% in terms of gross gaming revenue i gaming up about 27% with me now is the ceo of v mgm adam greenblat adam it's great to see you it's great to see you contesta the incredible growth that we're seeing in online play is it mostly coming from states that are ramping up that they're newly legalized or are you seeing incredible growth even in more mature states so it's actually both the the great news for both the uh the more mature states and the new states because it gives you a picture of what's ahead is um appetite and depth is is tremendous and more so than we anticipated at the outset of this of this journey we talked to you at super bowl and you were telling me about your high hopes for new technology at b mgm for regaining some market share that you've lost to competitors the tech is called angstrom how's it working out so we've been delighted with the performance of an you might remember that the first product that we brought to market was focused on mlb and uh what we we became bmgm became the home of the home run uh during the season and the number angstrom powered um uh home run bet increased your reno by 245 and this is all enabled by having different types of markets having more availability having better pricing and that's all powered by angstroms unique approach to pricing when i went to investor day for fanduel a couple weeks ago the company was very clearly happy having taken the number one ey gaming slot happy to have increased their moat around the number one position in sports betting can you catch up well i think in i gaming our strength is is demonstrable we've just won another reward for the third year in a row the i gaming operator of the year and um i think you'll see from some of the early trends that the work that we're doing in in uh product in jackpots in unique and special content only available at at bmgm is bearing fruit um bmgm gave away the largest jackpot ever uh in the history of i gaming uh in new jersey in august $65 million to one lucky player somebody who is playing online somebody who's playing online walked away $6.2 million richer on the day which is wonderful which is exciting but we've also been a pioneer in in our relationship between sports and gaming uh we have got um nba blitz uh we've got nhl gold blitz um these are sport properties and partnerships that that we've built games against and so this bridges our activity in sports with our activity in in i gaming and our sports players love it cross sell year on year is now increasing dramatically we're north of 50% cross sell on a week uh on a weekly basis so really pleased about the potential for both parts of the business i've heard a lot of chatter here at the global gaming expo about the competitive threat of unlicensed gaming whether it's sk bbased games or online sweep stakes models which the operators will say it's perfectly legal to offer these sweep stakes style games is that an existential threat to licensed eye gaming in the united states i don't think so look we as a as a legal operator will always operate within the bounds of of the rules and the law and so i think there there needs to be a a a process of definition scope definition i think um the opportunity for the sweeps uh operators i think the legality of of or the boundaries of of what they're uh uh engaged in still needs to be tested but we'll defend our turf naturally um but we don't we don't see it as existential in any manner at all uh i feel like i ask you this every time we sit together but usually there's a reason for me to ask it that mgm has just um partnered with groupo globo in brazil to launch bet mgm in brazil it will be a direct competitor to main and it doesn't have anything to do with the bet mgm that you're running here in the united states they've launched bet mgm on leo vegas in the uk again a direct competitor to one of your co-owners and tain is this sustainable is it putting you in a difficult position to dance between these two companies yes well just for clarity the uh the the joint venture of which i'm chief executive uh has exclusive rights to operate in the us so there's no there's no debate about who's doing what in in the united states and frankly we're operating harmoniously in north of the border in canada where both leo vegas and tin and the joint venture my b mgm are are all active in the market and you know it's it's not without a degree of of uh uh pleasure that we've come from nothing bm jim my joint venture has come from nothing to be the largest uh operator by market share um in in uh ontario so can we coexist yes are we coexisting yes relationship in the and uh board dynamic and conversation has never been better so i don't it doesn't put me in a difficult position at all what can you learn from ontario for the the rest of the united states south of the canadian border well what we see is uh a market where direct promotional activity is not allowed and that not withstanding a a business can flourish we're demonstrating that what i'm also excited about is the strength of the mgm brand north of the border and that's particularly relevant given that we have alberta coming which is going to be both a sports and i gaming state so it's the first i gaming state we've had in a couple of years and this is obviously b mgm's uh heartland it strength it's uh mgm resorts as a as a brand resonates particularly well uh with uh with gamers and so we're looking forward to capitalizing that uh on that when when alberta regulates how's football oh my goodness so the genesis to what to my excitement is the progress we've made in product and you you you did check angstrom but the whole product experience the bed mgm sports product experience is by some margin better than it's ever been our same game parlay experience our parlay experience our pre-build parlays our linear bet slip which allows us which allows players to see all their bet in a single pain uh a quick bet experience this is one titbit building a quick bet a little uh bar at the bottom of of the screen we've increased by the work we've done we've increased the number of legs on our quick bet by more than 100% and as we know more legs equals more margin and this is weeks in so really excited about the progress we're making our players are enjoying it our players are coming back from week to week in a way uh in a more engaged way than in prior periods and we've been helped by margin the first few weeks of the the season were really favorable to to to the industry and so september closed out what would be a record quarter for bam jy so really excited about that adam thank you for spending some time with me course thank you for having me,"Category: Other

Stock mentioned: None

Key takeaways:
* The sports betting and iGaming industries have seen significant growth in 2023, with sports betting gross gaming revenue up 30% and iGaming up 27%.
* Both newly legalized states and mature states are contributing to this growth, indicating strong overall demand.
* B MGM has introduced new technology called Angstrom, which has notably increased revenue in areas like MLB home run bets by 245%.
* B MGM continues to focus on unique offerings, such as exclusive games and large jackpots, to enhance their market position.
* Despite competitive threats from unlicensed gaming, B MGM remains confident due to its compliance with legal frameworks.
* B MGM has expanded internationally, as seen with ventures in Brazil and Canada, but continues to operate harmoniously with different partners in these regions.
* The strength of the MGM brand is expected to benefit B MGM in new markets like Alberta, Canada.
* B MGM has improved its betting product experience, which has led to increased player engagement and margin.
* Early season results in sports betting have been strong for B MGM, contributing to a record quarter."
tbFZxyVy0wI,Caesars Entertainment CEO on capturing market share in the digital business,2024-10-08 14:14:22+00:00,1,https://www.youtube.com/watch?v=tbFZxyVy0wI,and you mentioned the digital business you know the the powerhouse in this space is fanduel and draftkings coming in a strong number two and then there's this fight over the third and fourth positions how important is it to you you just launched a new online casino app horseshoe yesterday how how much is this important to the growth of caesar's business and can you make an impact can you grab market share away from the the two big players yeah well contest i'm oldfashioned i like to make money so i measure it based on how much money we're making not how much market share we have so our promo spend is a third to a half of what draftkings and fanduel have so those subsidies don't run through our ggr market share numbers but we've got a business that's approaching soon will exceed 20% eah margins in a business where most are still losing money,"Category: Other

Stock mentioned: None specifically mentioned in the provided text.

Key takeaways:
* Fanduel and DraftKings are positioned as the leading companies in the digital business sector discussed.
* A new online casino app, Horseshoe, was launched, aiming to enhance Caesar's business growth.
* Despite lower promotional spending compared to DraftKings and Fanduel, there's a focus on profitability over market share for Caesar's.
* Caesar's digital business is nearing a 20% EBITDA margin, contrasting with competitors that are currently losing money."
WlJt43brScI,Cramer’s Mad Dash: AMD,2024-10-08 14:13:03+00:00,2,https://www.youtube.com/watch?v=WlJt43brScI,"before opening bell, amd on the  docket. >> yeah. we've got a very big october  10th. san francisco media advancing  a.i., that is thursday, okay. that is going to be released as  an event. i think almost as important,  david, go back ten years to when the stock wasn't great. and you will see october 8th is  when they took over amd. >> so she's there ten years. >> not bad. >> so she's there ten years? >> ten years. >> i remember the early meetings with her. she took me out and said,  listen, you're on the wrong side of the train with the intel. get off the intel train and get  on micro horse. i switched and i switched hard,  david. and, man, look a","Category: Technology

Stocks mentioned: AMD, Intel

Key takeaways:
* AMD is a focal point before the markets open, with significant anticipation around its upcoming event on October 10th in San Francisco, which will highlight advancements in A.I.
* The transcript reflects on the transformative leadership of AMD over the past ten years, marking a considerable turnaround in the company's fortunes.
* There is a past strategic shift from Intel to AMD mentioned, indicating a significant change of perspective and investment choice in the semiconductor space."
xIdl-U4BOFo,"Opening Bell: October 8, 2024",2024-10-08 14:12:26+00:00,2,https://www.youtube.com/watch?v=xIdl-U4BOFo,"i switched and i switched hard,  david. and, man, look at that. >> no regrets there. >> no, some ceos are so good. and she is. >> let's get to opening bell  here in cnbc at the big board. [ bell ] international flavors  celebrating its 50th anniversary at the nasdaq capital. celebrating the 1 billion of the free cash flow etfs. >> the comeback, a deal that  didn't work out. but really started to -- let's  put it this way, it was one of  the great blue chips of our  time. i think for it to make a  comeback, it's going to take a  while. yesterday, david said, nike's  turn, this will take on nike. david, i can't tell you -- these things are hard to turn. >> you're talking about nike? >> nike. >> no, there's a lack of  patience, certainly, on the part of many investors.","Category: Other

Stock mentioned: Nike

Key takeaways:
* The speaker discussed a switch in strategy with a strong commitment, mentioning the satisfaction with recent decisions.
* Praise for a particular CEO's performance was expressed.
* A company celebrating its 50th anniversary and another celebrating significant free cash flow were mentioned at the stock exchange.
* There was discussion about a comeback attempt for a previously successful, now struggling, company, though specifics were not provided.
* Nike was identified as facing challenges in turning its performance around, with an emphasis on investor impatience regarding the time it takes for such changes."
ey_BI9P2Ugw,"Tesla will find it difficult to leapfrog existing players like Uber and Waymo, says Toni Sacconaghi",2024-10-08 13:39:38+00:00,5,https://www.youtube.com/watch?v=ey_BI9P2Ugw,"teased and the release of robo  taxis. but our knicks guest says a lot  of questions remain, including  regulatory issues around  self-driving cars, how tesla  will scale the service, and  ultimately, how much more  competition will be in the  space. joining us right now is  bernstein senior research  analyst, toni sacconaghi. good morning to you. what do you expect we're going  to hear? we've been waiting for this news for a long time. i think it's exciting to me, but also for many, there's some  skepticism about when it will  actually arrive. >> good morning, andrew. yes, i think the consensus is  that tesla will announce a  dedicated robo taxi model,  likely to be available at some  point in the future. let's say '27 or '28, that tesla will demonstrate a application,  whereby a ride-hailing app, that it will provide some sort of  update on where they are on full self-driving, and maybe also  potentially announce that it's  doing some robo taxi trials. i expect if they did that, those would have to be with an  accompanying driver. but nevertheless, starting  trials in one or my cities in  the u.s. i think that's generally what's  expected amongst investors. there are big questions about  whether tesla will provide  updates on optimus robot or  whether it will provide an  update on new models,  particularly the revamped models expected next year, or a  lower-cost model expected in  '27. but i think the focus will  ultimately be on a robo taxi,  you know, unveiling itself and  an accompanying ride-hailing  app. >> so, toni, we're looking at  the stock at $242.92. if, in fact, they make this  announcement, how does this  change the game? how does it change how you would value this company? >> you know, i think investors  are applying different  probabilities and discount rates to a robo taxi service going  forward. so i think it's widely  anticipated, but as you noted at the outset, there are lots of  questions. there are technical questions  about whether tesla can get to  the reliability level with a  more limited censor sweep. they only have cameras. other competing autonomous  vehicles have lidar and radar,  so there's technical question. i think there's a regulatory  question. there's a timing question. and you know, how competitive is this space going to be? are prices going to be driven  down and how much value will  there be to be captured? so investors are ascribing  differently possibilities and -- >> what possibilities are you  ascribing and how are you doing  the valuation then? >> this is what i think about  it, andrew. i think it will be difficult for tesla to leapfrog other players. uber and waymo are doing testing in other cities. even if tesla is able to  leapfrog, it i think it will be  a limited -- you know, limited  to a year advantage. let's say in a year, tesla has  level five robo taxis that can  go anywhere, they have a  ride-hailing service. my guess is, competitors will  catch up reasonably quickly. so this notion of having  sustained outside profits, even  if tesla were to leapfrog given  the technical hurdles and the  regulatory hurdles, i think are  difficult. and the valuation of uber is  $150 billion. the valuation of uber, you know, probably in the u.s. is half of  that, $75 billion. tesla's stock today embeds, we  think, $600 billion beyond the  core auto business. much of that ascribed to robo  taxis. we struggle with that  differential, given the  probabilities that i --  >> let me ask you this in terms  of the competition piece of it. which is to say, you made the  argument that you think that an  uber and a waymo will have an  advantage, maybe given lidar and other things over tesla. there's an argument to be made,  and maybe you'll disagree with  it, which is that they have a  number of the -- a number? thousands, tens of thousands of  these cars on the street today  that have cameras on them,  they're taking in data that  can't really be matched. if you look at some of their  self-driving features right now, they clearly seem to be the  leader or the most advanced in  terms of where that would be, if you were to sort of set aside  what waymo is doing. is there an argument to be made  that they will leapfrog  everybody? and that they in some ways  already have? >> well, i think the bulk case  is that they will leapfrog. i think it's very difficult to  say that they already have. because, you kno","Category: Technology

Stock mentioned: Tesla

Key takeaways:
* Tesla is expected to announce a dedicated robo taxi model, potentially available by 2027 or 2028.
* The company may also demonstrate a ride-hailing app and provide updates on full self-driving capabilities and potentially announce robo taxi trials.
* There are technical and regulatory challenges to be addressed, especially since Tesla uses only cameras while competitors use lidar and radar.
* The competitive landscape includes players like Uber and Waymo who are already testing autonomous vehicles in various cities.
* Despite potential advancements, the expectation is that competitors will quickly catch up, questioning the long-term profitability and market dominance.
* Current Tesla stock valuation includes significant expectations for future robo taxi services, which might be challenging to justify based on existing competitive and technical hurdles."
lccWPcRVe2w,Aristocrat Gaming CEO: Competition is good for the industry,2024-10-08 13:30:18+00:00,4,https://www.youtube.com/watch?v=lccWPcRVe2w,it's been an incredible year for casino game makers and designers and the stocks are on fire aristocrat gaming ceo hector fernandez joins me now it's good to see you it's great to see you to what do you attribute so much remarkable growth look i think we've really honed down and invested on the things that really mattered the number one thing that matters is all around dnd or r&d and creating game content that the players want to play and more importantly creating strong partnerships with our customers to ensure that anytime they put our games on the floor they know they're going to work i went to uh flutters investor day a couple weeks ago and fanduel ceo amy how was talking about their success with i gaming and she said what they found is that they have more success with games online if they are brands that gamblers know and love from casino floors so how much of your design comes from what works on the floor and how much of it comes from testing out the designs in the digital space and then bringing that to the casino floor sure we do a little bit of both but really when you think about the strength of aristocrat it's really around its legacy brands and the content we've created and if you think about the north american consumer particularly you're seeing that the north americ consumer has a strong affinity for the brands that they've played on the floor than we've brought to real life on a digital setting but another really important thing about that is one of the things that we focused and you and i have talked about this is how do we do it in a responsible way so we've invested very heavily also around a responsible gaming uh strategy and pillars uh we you mentioned the r&d i know a lot goes into it there was a lot of headlines over a lawsuit by aristocrat against competitor light and wonder over their game dragon train can you talk a little bit about creating uh a moat around the games that you're designing well you know we don't comment on ongoing litigation one of the things is pivotal for us is to aggressively defend our ip that we create okay and and you've talked to me in the past about the competitive disadvantage of non-licensed games so skills-based games if uh if you see those sort of slot machines pl proliferate proliferate easy for me to say if you see them proliferate how difficult is it for you to keep growing your business well how much of a competitive disadvantage is that we keep a very strong lens on what's happening around competitively and we actually really like competition competition is actually really good for the industry and one of the things that we do is look at industry trends and making sure that we stay ahead of those industry trends but we want it to be in a regulated environment it is really important when you look at the world out there that everything from a landbased uh st standpoint is a is in a regulated setting where does the growth come from does it come from more states legalizing online gambling does it come from more growth in bricks and mortar casinos it comes from both and that's the beauty of the aristocrat business is when you look at how successful we've been over the last 5 six years we've grown in north america we've grown in asia we've grown in europe and latin america and now with the acquisition of neo games we have the opportunity to grow online as states regulate eye gaming hector thank you for being with us,"Category: Other

Stock mentioned: Aristocrat

Key takeaways:
* Aristocrat Gaming attributes its remarkable growth to a strong focus on R&D and creating game content that players want, along with strengthening partnerships with customers to ensure effective distribution.
* The company has found success by utilizing its legacy brands that are well-known in physical casinos, as transitioning them to the digital space has been beneficial.
* Aristocrat Gaming is committed to responsible gaming practices, investing heavily in strategies and pillars supporting this commitment.
* The company enforces and defends its intellectual property aggressively, which includes litigation against competitors to protect its game designs.
* Aristocrat views competition as beneficial for the industry and focuses on staying ahead of industry trends while operating in a regulated environment.
* Growth for Aristocrat Gaming comes from both the increasing legalization of online gambling in various states and expansion in bricks-and-mortar casinos across different regions.
* The recent acquisition of Neo Games presents further growth opportunities for Aristocrat in the online gaming space as states regulate iGaming."
