Video ID,Title,Published At,Duration (Min),URL,Transcript,Summary
aTWQuavvNjI,Caesars CEO Tom Reeg on capturing market share in the digital business,2024-10-08 13:28:55+00:00,7,https://www.youtube.com/watch?v=aTWQuavvNjI,"getting back a little bit of  what they gave back yesterday,  35 points now on the dow. nasdaq a little bit stronger, up 82. s&p up 52. >> going to get over to contessa brewer, because she's got a  story on this. gambling's biggest luminaries  coming together this week in las vegas. contessa brewer is live at the  center of it all and she joins  us now with a special guest. good morning, contessa! >> good morning, andrew! and welcome to las vegas! look, caesars has a lot of news. they just announced new  buybacks, a new $1 billion in  debt offering, and tom reeg  joins me bright and early here  in las vegas. it's nice to see you. i'm just curious how much your  share price had to do with the  stock buyback and why does it  take that kind of news to juice  the stock of a company that has  been performing on all  cylinders. >> yeah, contessa, to go back,  we closed the merger with  caesars in july of 2020. we all remember, it was a  different world then. we had a significant capital  spending program that we stepped into when we bought caesars. we had $400 million we needed to spend in new jersey. we were building an expansion in new orleans that opens two weeks from now that was $435  million --  >> in time for super bowl next  year. >> that's right. >> and a new property in  virginia that's over $800  million that will open before  the end of the year. as we were reaching the end of  that cycle and looking at what  was happening with free cash  flow and where our stock was, it was an easy decision to start to buy some stock. in terms of where the share  price was, we were on the wrong  side of the macro trade while  the fed was raising rates. we were a levered company coming out of a merger. and now that the fed has moved  into a cutting cycle, we've seen a turn in our stock. >> you also just made a deal  with the union late last year  that gives the biggest pay hike  that your employees have ever  seen. you've got casinos all over the  country, the biggest operator in terms of number of properties in the united states. what are you seeing about the  american economy and where  customers are, that  discretionary income might be a  concern. >> yeah, i would say we're about the purest measure of consumer  discretiona ary given the busins that we're in. and it's been remarkably  resilient. we had the kind of a bubble when stimulus checks went out, and  that faded a little bit as that  money was spent, but the  consumer remains quite strong. you see here in vegas, i'm sure  this week, the market is packed. we're running at 99% occupancy  year round. the regional business is holding in well, and the digital  business is growing incredibly  strongly, so we've got a  business that did $2.9 billion  of ebitda combined coming out of the merger that's doing about $4 billion now. >> okay. first on las vegas, wells fargo  said its las vegas f1 room rate  tracker took a turn to the  downside with average daily  rates down 40% year over year. is that an indication that  there's not enthusiasm over f1? is that what you're seeing? >> i -- i would look at it more  as an indication of garbage  numbers. they're measuring really what's  8% of our room base in terms of  where rates were last year. it was well known that we held  rates very high coming into the  race and they dropped, as it  came. what we learned last year was  that we needed to fill sooner. so we're not holding rates as  high. if i look at, you know, f1 for  us, you know, it was a lift last year of almost $20 million --  >> wow. >> -- versus the weekend the  prior year. this year i would say, you know, flat to up or down a few million bucks versus last year, but up  the 20 versus two years ago. >> you mentioned the digital  business. you know, the powerhouse in this space is fanduel and draftkings  coming in a strong number two. and then there's this fight over the third and fourth positions. how important is it to you --  you just launched a new online  casino app, horseshoe,  yesterday. how much is this important to  the growth of caesars' business? and can you make an impact? can you grab market share away  from the two big players? >> yeah, contessa, i'm  old-fashioned, i like to make  money. i measure it based on how much  money we're making, not how much market share we have. so our promo spend is a third to a half of what draftkings and  fanduel have. so those subsidies don't run  through our ggr market share  numbers. but we've got a business that's  approaching, soon will exceed  20% ebitda margins, in a  business where most are still  losing money. >> before i let you go, you  know, we're keeping an eye on  florida and hurricane milton. i know you have -- your home is  in florida. i'm just -- how are things  looking for you? how is the situation for you,  being here and watching that  storm approaching? >> it's deja vu from two years  ago. i was in vegas watching ian hit  our home two years ago. this storm seems to be tracking  north of us. but we'll still have to deal  with surge and you should pray  for anybody that's in the middle of this. it's -- it's awful to go through these. and after the news cameras  leave, you know, a week or two  from now and go to where the  next storm is going to land, the people where it hits will have  to deal with this for the next  five or ten years. >> it is a monst","Category: Other

Stocks mentioned: Caesars Entertainment

Key takeaways:
* Caesars Entertainment announced new stock buybacks and a $1 billion debt offering as part of their ongoing growth and financial strategy.
* The company's stock value was impacted by macroeconomic factors, including the Federal Reserve's interest rate decisions, which affected their leveraged position post-merger.
* The American economy, particularly consumer discretionary spending, appears resilient, with Caesars' business performing well despite previous financial challenges.
* Caesars is seeing strong performance in both their regional and digital business sectors, with digital initiatives contributing significantly to their EBITDA growth.
* Room rates for Las Vegas events, such as F1, are facing some challenges, but Caesars adapted its pricing strategy based on past experiences.
* The focus on profitability over market share is emphasized for Caesars' digital business, with plans to continue their expansion without matching the heavy promotional spend of competitors like DraftKings and FanDuel.
* The potential impact of natural disasters such as hurricanes is highlighted, emphasizing the long-term recovery challenges faced by affected communities."
ulmEvbjx2NI,Hurricane Helene's devastating impact on North Carolina: What you need to know,2024-10-08 13:28:04+00:00,5,https://www.youtube.com/watch?v=ulmEvbjx2NI,"they're also scrambling to clear remaining debris leftover from  helene just two weeks ago, which could turn into projectiles with high winds and that makes all of this that much more dangerous  and complicated. >> meantime, recovery efforts  from hurricane helene, which has now claimed at least 230 lives,  continue across the southeastern united states. officials are tackling storm  damage and misinformation  related to the storm. let's bring in julia coin. she's a reporter with the  charlotte observer. she's been out in the field  covering the storm's devastate  impact on north carolina. her newspaper, in fact, has a  reality check page to fact check misinformation related to the  hurricane and the recovery  efforts. and julia, we want to thank you  for being with us. i know you've been out on the  ground there. tell us, first of all, what  you've seen in terms of the  devastation. and by the way, you're someone  who comes from sanibel island in florida. you have seen hurricanes before, but what did you think of what  you saw this time? >> yeah, so i've been on the  ground and also up in the air  and embedding with pilots who  are using helicopters to air  drop supplies and also pilots  who are in small bush planes  surveying the damage, trying to  see if roads are accessible, if  anyone's sending smoke signals,  that sort of thing. i've been both on the ground and in the air, seeing the damage  and it's just -- it's extensive. it's eerie how common the sights become, both when you're walking around and flying above, just  seeing all of the devastation in the area. >> i mean, i've been reading  about how they're still trying  to recover bodies at this point, going out with cadaver dogs,  taking them on the rivers,  trying to sort through the  debris that's piled up all over  the place. this is a horrible situation. there have been lots of concerns about the abilities of the  rescue efforts. what would you say with what  you've seen? >> yeah, so i have been mostly  involved with volunteers on the  ground. i've met a few organizations  leading relief efforts and  rescue efforts that have brought those dogs out. i haven't heard numbers above  one or two bodies recovered per  town, but of course those  numbers continue to develop  every day. >> what do you think about  fema's response to this? there have been a lot of  accusations that have been made  that fema is not doing enough,  that they weren't prepared for  this, that they are turning away some of the local volunteers who have been right to bring things  in. is that the case? >> i have not seen that. again, i have been involved with those volunteers and talking to  people on the ground. so i can only speak to what i've run into, in those situations  and i can say that a lot of  people who are in these very  isolated communities haven't  seen government efforts, but  that's just what they're seeing  in these very small towns that  only locals really know how to  navigate. >> right. how -- what is most needed at  this point? what do people there say that  they would need from the  outside, whether that be  volunteers or the government? >> these people are  self-described stubborn people,  so when we show up with  supplies, at this point, most of them are pretty set. they are still asking for  diapers above the size of 5 and  efforts are now shifting to keep people warm, as cold weather  rolls in. that could mean blankets, socks, coats, that sort of thing. >> i know one of the places that you went was to rescue a  70-year-old woman and her dog. they were running short on  medical supplies, that's really  another layer of things that  they haven't talked about. even if you were there and were  supplied for things, you may not have anticipated you would need  two, three, four weeks of  medication or other items. how big is the need for that? >> right. so that area, specifically, they received a few days of rain  before the storm came. so this woman's doctor's  appointment was canceled. and she did not have her heart  medicine, even before helene  came. so i was with the helicopter who was able to lift her out, but  that's just one story of many. that's why access to roads and  areas to land have becom","Category: Other

Stock mentioned: None

Key takeaways:
* The video focuses on the aftermath and recovery efforts following Hurricane Helene, which has claimed at least 230 lives across the southeastern United States.
* There is extensive damage in the affected areas, with efforts involving both ground-based volunteers and aerial surveys to assess and provide supplies.
* Recovery efforts face challenges, including misinformation, limited government presence in isolated areas, and the stubbornness of locals, who often resist external help.
* Essential needs still include larger-sized diapers, warm clothing items like blankets and coats, and medical supplies, particularly as cold weather approaches.
* Helicopter rescues are vital, especially for vulnerable individuals needing medical attention or medication."
y2B67UJhx94,GM investor day: Key insights to expect from the automaker,2024-10-08 13:14:05+00:00,4,https://www.youtube.com/watch?v=y2B67UJhx94,"box."" gm ceo mary barr expected to  tell the automakers how to talk  about to investors. >> pop quiz time. do you know what this is? take a guess. this is one battery cell. one battery cell. i want to give you some  perspective on the ramp-up in  production of battery cells here at the ultium cells production  plant. ultium else out of south korea. there are 36 of these cells in  each of these carriers as they  go through final production  here. some perspective on how many  they're manufacturing here. look over here. it's a little hard to see, but  all the way down there, you see  those blue krcrates, there's abt 2 million cells that have gone  through production down there,  and as we come over here, i'll  show you how big this facility  is. by the way, they're only at 40%  capacity. they're just scratching the  surface in terms of what they  plan to do in manufacturing  here. another 3 to 4 million cells in  these crates over here. all of these cells, by the way,  will be manufactured and out the door in 15 to 20 days. and again, they're at 40%  capacity. why are we in here? by the way, the first cameras  that have ever been here for a  live report in the battery  production area. the reason we're here is because this is critical to what mary  barra will be talking about  today at the gm investor day. ev variable profitability. that is the target that they  have set all year, to get there  by the end of this year. where are they on that path? do they still believe they can  get to variable profitability. they are clearly ramping up ev  production. we saw it yesterday. you clearly see it here in this  battery cell production  facility. also, peak profits. evs are a big part of the future for general motors, but peak  profits right now in terms of  internal combustion engine  vehicles, more than a few people are questioning if they can  continue to be as profitable or  growing profit in that area. and finally, what's happening  with china? is there a restructuring in the  future there. general motors, as you take a  look at shares of gm, they have  lost $210 million in china in  the first half of the years. there was a time, just a few  years ago, where general motors  was making a couple billion  dollars a year in china. but as that market has dlachang  dramatically, general motors is  facing tough questions there. all of those questions will be  front and center when we talk  with mary barra exclusively  later today, ahead of the gm  investor day here in spring  hill, tennessee. we'll discuss not only china, ev production, the ramp-up in evs,  getting to variable  profitability, and where general motors is right now, in terms of its plans for continuing to grow profits. so lots to discuss with mary  barra. and this is a very cool place ","Category: Macro

Stock mentioned: General Motors (GM)

Key takeaways:
* General Motors is ramping up its electric vehicle (EV) production, focusing on battery cell manufacturing with their Ultium Cells joint venture.
* The plant is currently operating at 40% capacity, with plans for significant production increases.
* Achieving EV variable profitability by the end of the year remains a primary target for General Motors.
* General Motors is experiencing peak profits from internal combustion engine vehicles but faces uncertainty about sustaining these levels.
* The company's performance in China is under pressure, having incurred a $210 million loss in the first half of the year compared to past profitable years.
* There are strategic questions regarding GM's future in China, which will be a key topic of discussion at the GM investor day."
TeC01hk5PpY,Former House Speaker Kevin McCarthy: Harris is running against someone rather than for something,2024-10-08 12:48:15+00:00,8,https://www.youtube.com/watch?v=TeC01hk5PpY,"is making the media rounds now,  starting with the week off with  cbs' ""60 minutes."" the vice president discussing  her plan for the economy, still  fell short of providing answers  on how she's going to pay for  some of the agenda. joining us to talk about this  and much more former house  speaker kevin mccarthy. we are seeing her venture forth  now, after what some would say  was quite a while and i don't  know whether you'd say she was  sort of forced to do it. why do you think it's happening  now? >> well, she's being forced. her whole plan was to stay away  from the media all the time and  it started playing against her. but, okay. she's gone on ""60 minutes."" but anyone tell me her three  points of what she's going to do if she wins? no. and so, it's not breaking  through. you've got -- if you ask --  >> i can tell you what she said. >> yeah, i can tell you what she said. >> yeah. what are the three things she'll do if she wins.  >> try to deal with housing,  right? >> with $25,000, yeah. >> no, $25,000, going to build  more houses so there's a greater supply. she says she's going to give a  $50,000 credit to small  businesses, right? what else is on your list? >> i'm sorry, you can't run for  president -- you can't say, i'm  going to stop immigration, build a wall, make the economy  stronger. >> the idea that you're eye  sasa  i saying that nobody knows --  >> she's going to raise taxes on corporations. going to raise taxes on  individuals. she's going to do that to  maintain and increase programs  for what she says is the middle  class. she says she's going to support  roe v. wade, those are the  things she's going to do. on the other side --  >> you can't have it clear. running for president every  single time --  >> running for president by not  being donald trump. >> yeah, she's running against  something instead of for  something. so if she was to win, to govern  would be very difficult. and, look, i think everybody is  missing the wrong polls. this is a very close race. there's no undecided voter  anymore. it's whatever candidate is able  to get out the low-propensity  voters. only interesting bowl is gallup. they don't know who you're  voting for, they ask who do you  identify, republican or  democrat. for the very first time,  republicans beat democrats. by three points. you see the disparity between  republican and democrat, usually three or five points, you can  tell who wins the presidency. the second question they asked,  who was best to solve the  problem in the future,  republicans. it's a better climate,  republicans should be performing better. and it all inches down to  pennsylvania. and pennsylvania is tied right  now. if you look back four years ago, biden was winning in  pennsylvania right now by a high number. if you look at wisconsin, biden  was winning wisconsin by six  points but only won it by 20,000 votes. so you can't play into the polls that are in the margin of error. what do they mean? and is trump still getting the  underpoint that he's made  before. >> there's a possibility that  there's a massive undercount  going on we saw it in 2016 and  2020. >> could you even ask for more  fairness -- i'll make one point, the outrage machine for elon  musk for now endorsing trump is  out of control. now, twitter is still a free  exchange of ideas from both  sides. on the other hand, ""the new york times"" just endorsed kamala  harris. that's the 17th straight  democrat ""the new york times""  has endorsed since dwight d.  eisenhower. that was the last time, that was 1956. take your pick of any democrat  you want to go along the way. they've endorsed every single  one. >> mondale over reagan. >> the arbiter of all truth and  all fair, journalistic  integrity, in the world, does  that every year. not a word is spoken about --  >> can i just say something? there's --  >> okay, but what about the 17  times --  >> an editorial page of the  newspaper --  >> okay. >> i understand that. there's a news page. if you want to the conflate  them, you can go ahead and --  >> i am conflating them. >> i understand that. >> i see the choice of -- look,  there's an overriding viewpoint  from the ""times"" and everywhere, andrew. not just the op-ed page. 17 straight. >> theres what an editorial --  but it was an editorial page. i just don't understand --  >> you don't think the rest of  the paper --  >> no, and i'm not going to  engage in that with you. >> do you ever feel like a  divorced child? >> no, you cannot deny it, i  think the arbiter of ""the new  york times"" -- your overall  point which you bring into the  news conversation every day --  >> right. >> the overall point that you  bring into the news conversation every day is one of a  conservative republican who is  explicitly supporting this  president. that's a distinction. >> i'm talking about at this  point, elon musk has suddenly  totally left -- keith goldman  said he needs to leave the  country. and x shut down. >> i think the point that joe is making, you get treated  differently if you come out and  endorse trump. people loved elon before. i think overall, as americans,  we've got to get to a point  where we can respect somebody's  differences of opinion, right? you may have a difference of  opinion. i was just texting with somebody today that's mad at me about my  party. right? i still like the individual. i just texted back, you made me  smile. you made me laugh, right? i respect that you have a  difference of opinion, but i  want to have those discussions  and not dislike you over it. elon, we can't bring our  astronauts back from space  unless it was for elon. we just had a hurricane where  these people can't have internet unless it was for elon. if somebody from the left and  cared about the environment, the only person that developed an  electric car that everybody  loved was tesla. because it hinges on the first  amendment -- that's what got  him. >> the deal with elon and trump, his businesses will benefit  instead of --  >> no --  >> -- obviously, the preferred  candidate for elon musk is --  >> elon's preferred candidate is the constitution, more than a  person. overwhelmingly -- look, i've  known elon for more than --  before he was very wealthy. and he's always hinged","Category: Politics

Stocks mentioned: Tesla

Key takeaways:
* The Vice President appeared on CBS' ""60 Minutes"" to discuss her economic plans, which include building more houses, offering credits to small businesses, and raising taxes on corporations and individuals.
* The political landscape is very close, with Republicans and Democrats nearly tied in key states like Pennsylvania and Wisconsin.
* There is ongoing discussion about media biases, specifically regarding endorsements and coverage from major outlets like ""The New York Times.""
* Elon Musk's endorsement of Trump has caused controversy, highlighting the challenges of political endorsements for public figures like Musk.
* Despite political differences, there is a call for respect and dialogue across opposing views, noting Musk's contributions to technology, particularly his work with Tesla in the electric vehicle market."
