Video ID,Title,Published At,Duration (Min),URL,Transcript,Summary
Xme5fszg08s,Greene: The markets have been resilient despite recent challenges.,2024-10-08 12:36:56+00:00,4,https://www.youtube.com/watch?v=Xme5fszg08s,"un unwinding of the yen carry  trade. joining me now is victoria  greene. vicky, great to see you.  >> good morning, frank.  >> vicky, give us your word of  the day. >> it's a tempest. a violent, windy storm that  could disrupt economic data  going forward. finally, we get to earnings on  f  friday. we have to weather the tempest. we are watching yields  carefully. a lot of that move's done. that should hold. the fed is pricing in 22 bps of  cuts in november. another maybe 25 bps in  december. you repriced expectations a bit. man, we had a lot thrown at us  in october. the markets have been resilient  given the data that has come out from macro to geopolitical and  two massive hurricanes in two  weeks. all resilient in the bull  market.  >> vicky, you are mentioning the ten-year yield above 4%. i talked about this on the show  yesterday. people texted me it didn't  matter and others saying it is  meaningful. is the two-year above 4%  meaningful? >> sure. if you hit the 4.5, it becomes  meaningful. i think it is priced in and able to be absorbed. if we seethe change in fed  policy, the trickle down effects are difficult with the equity  with growth stocks and  technology. i'm watching this. it doesn't scare me. 4.5 or moving to 5 is not priced in and that an unpriced move. >> you are bullish on earnings  in q3. 5% for the year for the s&p. energy down 22% year over year. possibly, back to the theme of  tempest, a lot of things  geopolitically and a storm. are we ipricing this in? >> it has been a tough uarter. q3 was ugly for oil prices. a lot will be going forward. what does that look like on the  go forward basis? q3 is priced in. it will be a decline because oil prices fell. i think energy is discounted a  lot. if you look at the buy ratings,  you get the dividends. it is a good total place. you have push-pull politics with china coming online which is  bullish for oil. then you have barrels coming in  from opec which have been  sidelined. you could see those move in the  middle east. >> i want to get to your pick. pepsi. i know it is ahead of earnings. out performing. why are you defensive in the  rate cutting cycle? >> it is a great dividend. they are well known ","Category: Macro

Stock mentioned: Pepsi

Key takeaways:
* The yen carry trade is being unwound, which could impact economic data moving forward.
* The Federal Reserve is anticipated to cut interest rates by 22 basis points in November and another 25 basis points in December.
* Despite various macroeconomic challenges, including geopolitical tensions and natural disasters, the markets have shown resilience.
* The ten-year yield above 4% is being observed for its potential impact, with the two-year yield above 4% being considered significant if it moves to 4.5% or higher.
* There is a bullish outlook on Q3 earnings, with an expected 5% growth for the S&P 500 for the year, although the energy sector is expected to decline due to falling oil prices.
* Energy is considered discounted, with buy ratings providing dividends, despite the decline in oil prices impacting Q3 results.
* Pepsi is highlighted as a defensive stock pick in anticipation of a rate-cutting cycle, due to its strong dividend performance."
dTBHL5-Apec,Waters: The damage from Hurricane Helene is $11 billion...most from wind.,2024-10-08 12:35:44+00:00,5,https://www.youtube.com/watch?v=dTBHL5-Apec,"joining me now with the expected economic impact on milton and  the tally of hurricane helene is moody's director of hurricane  models jeff waters. jeff, good to see you.  >> thanks, frank. >> a serious situation here. milton. this is the first time tampa bay area has taken a direct hit in  almost a century since back in  1921. in your mind, what does that  mean about the potential impact  to residents and also property? >> yes, it's very clear here  that the entire coastline of  florida, especially tampa to  fort myers should be on alert  and take the precautions to  evacuate or mitigate their homes as much as they possibly can  against the damaging potential  of wind, but especially storm  surge in this event sglfrmt what i was trying to get to is wore  seeing storms in areas that are  more severe. this is an area that hasn't seen a big storm in almost a century. generally, with construction  built with the idea a hurricane  would come through, whether  residential or commercial or  even government? >> in some cases, yes, in some  cases, you see coastal  properties built at grade. maybe not on stilts or at  elevation. all of these coastal problems,  especially the tampa-st. pete  area. this is will one of the events  that everyone will watch  closely. as you mentioned, tampa bay and  st. petersburg has not seen this in some time. there are a few that are built  at grade and will be subject to  quite storm surge. >> wishing the best to all of  the people there. i want to turn back to hurricane helene. our best estimate from the  damage of hurricane helene is  $11 billion. most of that is from wind and  not water or anything else. with milton, winds increased and a lot of the areas are  recovering from helene, milton  is coming in with strong winds. what are you expecting? how damaging could this be to  property or how life threatening could this be? >> first, the building codes in  the state of florida are the  strong of thein the country. there is a lot of overlap with  milton compared to helene. you will have a lot of damage  that could be exacerbated with  the structures prone to damage a few days back and that could be  tricky in trying to understand  how much worse things get and  trying to figure out which event caused the damage. the building codes are very  strong in florida and especially along coast at areas. we hole fully will see some of  the build back better techniques and codes take action. it will be challenging,  especially with all that debris  that is still on the roads and  in places like tampa that will  make matters a heck of a lot  worse when it comes to seeing  the oncoming impact of milton in a couple days.  >> i've covered a hurricane. i was in new orleans with  hurricane ida. i have seen the damages. when we are talking about  uninsuredd losses, how bad coul  this be? >> it is too reearly to tell. you see the gap with the water  losses with the insured and  water. not as many people have flood  insurance coverage. with helene, and whatever water  impacts are to come, the  economic toll could be bigger  and is a lot impacts. given the coastline from tampa  down to fort myers is in the  cone of uncertainty. that represents the biggest area along ","Category: Macro

Stocks mentioned: None

Key takeaways:
* Moody's director emphasizes the serious impact of hurricanes on Florida's coastline, particularly in urban areas like Tampa Bay and St. Petersburg, which have not experienced major storms in nearly a century.
* The focus is on the potential damage due to wind and storm surge, highlighting vulnerabilities in coastal properties that may not be adequately built to withstand such events.
* There's a concern about the overlap and compounded damage from Hurricane Helene and the forthcoming Hurricane Milton, stressing the challenge in assessing total damages due to the rapid succession of storms.
* Strong building codes in Florida are noted, which may help mitigate some damage, but the presence of debris and previous storm effects makes recovery and impact assessment complex.
* The issue of uninsured losses is significant, as many areas do not have sufficient flood insurance, potentially leading to major economic tolls. The cone of uncertainty extends from Tampa to Fort Myers, signaling that a vast area could be impacted by the storm's effects."
8K4VInX_f7I,McGhee: Stimulus effects will take time; it's a midterm play for LVMH and Estée Lauder,2024-10-08 12:14:55+00:00,4,https://www.youtube.com/watch?v=8K4VInX_f7I,"now it's tiffany mcghee's turn. the cio of pivotal advisors. good morning, tiffany. how are you? >> good morning, frank. how are you? >> let's start with your first  pick. lvmh. we heard about the luxury makers under pressure with what's going on in china. what are the opportunities you  see with chinese stimulus? >> so, listen, when we think  about what the aspects of the  chinese stimulus are, there are  three of them, the monetary  stimulus, the mortgage rate cut, and also have new monetary  policy to support the stock  market. we see when that announcement  was made, the areas that kind of reacted positively. we see consumer staples and  financial services and semis  were the main ones. when we think of the chinese  consumer and what benefits  overall, luxury and consumer  st staples. estee lauder is a must have. we put that in the luxury  consumer staple category. china has been such a huge part  of estee lauder growth over, you know, the long term. they really cut estimates in the past a few quarters based on  pressure from the asian travel  are retail. >> tiffany, quickly, while we're talking about chinese stimulus  today, i know you gave us your  picks yesterday. an update. it is disappointing investors  about the stimulus. in your mind, your thesis with  lvmh and estee lauder, does the  stimulus continue or is that  enough to give a big boost in  sales? >> no, listen, i don't think  we're seeing the entire  implications of the stimulus  play out. this will take time. think about in the u.s. when we  got stimulus checks out of the  pandemic. it wasn't just a couple of  months. you know, this is going to take  some time. we like both lvmh and estee  lauder not in the short-term,  but midterm. look at where they're priced  right now at a discount to their prices all year. they've got really, you know, we really see this china stimulus  affecting them positively over  more than just the short-term. >> okay. you mentioned moisturizer is a  must have. there are other things that lvmh sales that is not beauty. they have soft luxury. this your mind, outside of  china, what reaccelerates the  sales there? in europe, i was there earlier  this year. consumers are under a bit of  pressure. >> yeah, listen, you know, lvmh, i call it the stock or the brand that has everything you need to  have a well lux life. to your point, they have so many different areas of luxury. we like that diversified revenue stream. the consumer is cyclical, but we were talking about china  earlier. to put this in perspective, the  chinese consumer is 20% to 2","Category: Macro

Stocks mentioned: LVMH, Estee Lauder

Key takeaways:
* Chinese stimulus efforts include monetary stimulus, mortgage rate cuts, and new policies to support the stock market.
* Consumer staples, financial services, and semiconductors reacted positively to the stimulus announcement.
* LVMH and Estee Lauder are seen as benefiting from Chinese consumer activity, with China being a significant growth driver for these companies.
* The stimulus impact is expected to unfold over time, akin to the U.S. stimulus checks during the pandemic.
* The pricing of LVMH and Estee Lauder stocks is currently considered discounted, offering a midterm investment opportunity.
* Despite European consumer pressure, LVMH’s diversified revenue stream across different luxury segments provides stability.
* No mention of small caps, Nvidia, Tesla, or Meta in the transcript provided."
Jq2D0ZPh8Ds,"Amazon Prime Day is expected to gain more global members, benefiting the company: Evercore's Mahaney",2024-10-08 12:14:53+00:00,6,https://www.youtube.com/watch?v=Jq2D0ZPh8Ds,"kicks off today, hoping to lure  shoppers with exclusive sales  and deals. joining us mark mahaney,  evercorp. a.i. research. it's your favorite stock above  all of them, mark. not necessarily for prime days  but for some other moves that  the economy is making, really,  through like prime tv. >> that's right. it's our number one pick in  large cap and in mega cap. we think we're going to have  ongoing margin expansion both in the retail business and in the  aws business, as per the company as a hole. and free cash flow is continuing to improve. we think we'll see accelerating  growth. and stable growth, double-digit  growth in retail business. you put that all together and  there's a lot of valuation. so, yeah, we like amazon. and prime days just another  feature of it. it's not a needle-mover for the  quarter per se, but it certainly helps and probably will bring in more prime members worldwide  which is always a win for  amazon. >> in terms of operating income, how much does advertising  represent right now? >> oh, that's a good question. they're doing about 50 billion  now, run rate and ad revenue. and they don't disclose what the margins are, gut, geez, it's got to be pretty high, joe. i'm guessing they're doing  almost 50% margins on that if  you look at what google and met  tar doing on that sort of scale, 50 billion in ad revenue, 25 to  25 billion in ad revenue. a substantial profit. the two biggest profit-drivers  here or aws and advertising. by the way, the good thing for  arm zahn and amazon  shareholders, the fastest part  of the business are the highest  margin. it's called the wonderful fix  shift. >> you made a good point. you can only estimate margins  for the advertising side of it. there's a lot more ads now and  there's a lot more content that  sort of -- sounds like nbc, but  there's must-see tv, and number  of options are increasing  especially sports for amazon. >> yeah, joe, strategic pivots  at the company. they've really leaned into being a medial entertainment power is  a strong word. license content, theatrical  content. and over the last few years  we've seen them lean into sports where you get massive audiences. major reach, major frequencies  and you get high cpms. and beginning this year, they  started layering in ads into  amazon prime video. it was one of the biggest  monetized potential ad platforms out there. we think that will help with  profitability. in fact, it's probably the  single biggest driver of ramping margins with profitability. the other one, on the retail  side, they went through a major  capex cycle in 2022 and 2021,  and going into 2022. now they're sort of leveling  that out. and you've got rising  capitalization ute las vegas,  using in centers that they may  have overbuilt. but rising capital utilization,  there's another word for that. it's margin expansion. you get two really nice  tailwinds here. there's headwinds here, they've  got a system called kiper, as  long as they break that out and  give us a sense of what those  costs are and revenue  opportunity, i think the market  will give them a little bit  benefit of the doubt for that. >> do they have any businesses  that would be recession  resistant if the day ever comes  where there's a slowdown? it seems like a lot of these  things will be economically  sensitive? >> no, there's no recession  resistance here, other than, you know, there's a fair amount of  spend which is house hold  essentials. aws, as a business, is kind of  core to most companies. you know, you need to keep the  lights on. you need to keep your data  served up and saved up in the  clouds and the vast -- i don't  know what percentage of amazon's retail business is consumer  discretionary, north of 60%,  maybe 70%. no, if there's a real slowdown,  discretionary spend, given the  size, 10% retail sales, about  the size of walmart, they would  absolutely see an impact to  their growth if there was a  recession. >> okay. we got it there. what's your price target, you  raised it, didn't you? >> yeah, we did. we did. we're up to 250 now, 2026, 30  times three times cash flow gets yo","Category: Macro

Stock mentioned: Amazon

Key takeaways:
* Amazon is highlighted as a top pick in large-cap and mega-cap categories due to anticipated ongoing margin expansion in both retail and AWS (Amazon Web Services) businesses.
* Amazon's advertising business is estimated to have high margins, similar to those of Google and Meta, with ad revenue running at about $50 billion.
* Strategic pivots have been made by Amazon, including a stronger focus on media and entertainment, and integrating ads into Amazon Prime Video, potentially driving profitability.
* Amazon went through a major capex cycle but is now expected to gain from rising capital utilization, contributing to margin expansion.
* AWS is seen as an essential business component for many companies but is not entirely recession-resistant, as a majority of Amazon's retail business is consumer discretionary.
* There are some headwinds, such as Amazon's investment in the Kuiper satellite project, but the market may give the company the benefit of the doubt if the costs and revenue opportunities are well-articulated.
* The potential impact of an economic recession on Amazon's growth is noted as a concern due to its reliance on consumer discretionary spending."
NtphF52rwUE,"Kamala Harris sounds like a 'moderate Republican,' says Pollster Frank Luntz",2024-10-08 11:43:15+00:00,4,https://www.youtube.com/watch?v=NtphF52rwUE,"box."" the harris-walz campaign onn th  media blitz this week. here is vice president kamala  harris on ""60 minutes."" >> my plan is saying when you  invest in small businesses, you  invest in the middle class and  strengthen the economy. small businesses are the  backbone of the american  economy. >> pardon me, madame vice  president. my question is how do you pay  for it? >> the richest among us who can  afford it pay their fair share  in taxes. it is not right that teachers  and nurses and firefighters are  paying a higher tax rate than  billionaires and the biggest  corporations. >> joining us now is pollster  and strategist frank luntz who  watched that interview. what was your reaction for  somebody who focuses on words. >> first off, she is now, but  took a while, but she is now  taking the tough interviews and  asked the tough questions and  being challenged. ""60 minutes"" did an outstanding  job trying to get answers. secondly, it is donald trump who is ducking debates and the  interview on ""60 minutes"" and he backed away from. she gets credit for that. third, this is important. she asked the question about pay your fair share. this is language from the  democrats that has gone back 25  years now to al gore in 2000 and no one has yet defined and  harris does not do it here what  exactly is fair share. what is the rate? how much? how do you pay it? it's a legitimate question. i want to give her credit for  one important use of language. in the convention, the democrats talked about freedom. that's normally a republican  issue. here, she calls and asserts i'm  a capitalist. that's something you hear from a republican candidate, not the  democratic candidate. now she is focused on small  business, which has always been  a republican issue. andrew, she is taking pages out  of the republican playbook. she sounds, if you just listen  to the general statements, she  actually sounds like a moderate  republican. so the challenge for the trump  campaign is to stop withcessant  issues and her claims. i'll tell you something, going  to the new york times poll, she  is beginning to cut through. >> that's where i wanted to go  with this next. you're in the polling business  and in the business of reading  polls, if not your own. what do you see happening in the polls in the swing states in  particular? not the national polls,  necessarily, but in the swing  states where both of the  candidates are spending  virtually all of their time. >> it makes sense because  every one of the swing states is within the margin of error. every swing state could end up  in the harris camp or the trump  e camp. with this election with one  month to go is so darn close. i can't find the time or  historical precedent for this  when the two candidates 30 days  out we","Category: Politics

Stocks mentioned: None

Key takeaways:
* The Harris-Walz campaign is focusing on small businesses, emphasizing their importance to the American economy and proposing that the richest pay their fair share in taxes.
* Vice President Kamala Harris featured in a ""60 Minutes"" interview discussing economic proposals and tax strategies, a departure from the usual media approach by Democrats.
* Frank Luntz, a pollster, notes Harris's approach appears to include language traditionally used by Republicans, such as focusing on capitalism and small businesses.
* There is discussion on the current close political race, particularly in swing states, indicating a tightly contested election."
HNF52Nzdduo,Taxpayers in federally declared disaster areas in 25 states granted extended tax deadlines,2024-10-08 11:39:52+00:00,5,https://www.youtube.com/watch?v=HNF52Nzdduo,"for the year to date, shares  down 23%. the company's ceo will be on  ""mad money"" with jim cramer at  6:00 p.m. eastern time.  >>> and there's a tax deadline  looming for millions of  americans who already had an  extension to file the 2023  federal income tax returns. it's an extension on an  extension. i'm done to let you know. some taxpayers may qualify for  even extra time. sharon epperson joins us now. it was april 15th. then october 15th. >> and one week from today. >> how long now? >> this is what i will tell you. the irs says there are 19  million tax filers which  requested an extension in april. the final deadline is one week  from today, tuesday, october  15th. with the natural disasters  impa impacting, you will get more  time to file. that includes 25 states and new  territories. new filing deadlines from  november 1st of this year to may 1st of 2025. that includes seven states  impacted by hurricane helene. the additional extensions gives  time to file, but not pay since  the disasters occurred after the original april 15th filing date. there are two types of  penalties. if you missed the extension due  date, the penalty is 5% of  unpaid taxes per month or  partial month up to 25%. if you didn't pay enough by the  original april 15th deadline,  the late payment penalty is half the unpaid balance up to 25%. you also will incur 8% interest  on unpaid taxes. what do you do if you can't pay  all you owe right now? you can set up a short-term  payment plan with the irs to  give you up to 180 days to pay  $100,000 or less in tax  penalties or interest. you can set up a long-term  payment plan to pay monthly if  you owe less than $50,000. there is an 8% interest you have to pay on unpaid taxes on those  payment plans as well. it's important to make sure as  much as you can when you can as  soon as you can. preferably before the april 15th deadline. >> if you don't know how much  you oh, can you write a big  check and figure on a refund? >> 90% of whatever you owe the  year before, try to pay at least that much and that will put you  in better standing.  >> is that how you avoid a  major -- you know that it's  going to be next year's filing  soon. that's what gets me.  >> i know. it comes up so quickly. what it is this time of year is  a really good wake-up call for  people to figure out what they  can do for the 2024 tax year and do what they can do and maybe  adjust withholding or payees  estimated taxes as well. adjusting withholding is a  better way to do it if you can  because then the irs is assuming you are making those payments  along the way and you don't get  the under payment penalty.  >> i saw this.disaster area,  you can get an extension. if you are not in a disaster  area, like an idiot, i needed  information in an area that had  a disaster. can i get the extension? >> it is for taxpayers in those  areas. >> i can't get any information.  >> you can't get the  information, that is something  to bring up to work with your  accountant about certainly and  bring up to the irs. there are people who are, if you are military and combat zone,  you mi","Category: Other

Stock mentioned: None

Key takeaways:
* There is a tax filing deadline approaching for millions of Americans who requested an extension for their 2023 federal income tax returns.
* The final deadline for most taxpayers is one week from today, which is Tuesday, October 15th.
* Extensions on filing deadlines apply to those impacted by natural disasters, allowing them more time to file, but not to pay.
* There are penalties for not meeting deadlines: 5% of unpaid taxes per month for filing late and a 0.5% per month penalty for payments made after the original April 15th deadline, with 8% interest on unpaid taxes.
* Taxpayers can set up payment plans for what they owe; a short-term plan provides up to 180 days for payments of $100,000 or less, and long-term plans allow monthly payments for balances under $50,000.
* It is advisable to pay as much as you can towards the taxes owed before deadlines to minimize penalties and interest.
* Taxpayers in certain disaster areas may qualify for additional deadline extensions, and military personnel in combat zones may have different provisions."
